{
  "$schema": "https://ui.kitn.ai/schemas/construct/v1.json",
  "name": "ops-console",
  "layout": "aside",
  "provider": { "mode": "endpoint", "url": "/api/chat", "wire": "openai" },
  "theme": { "accent": "#0ea5e9", "mode": "system" },
  "capabilities": {
    "starters": ["Deploy payments to production", "Check the canary status"],
    "attachments": { "accept": ["image/*", "application/pdf"] },
    "history": { "persistence": "local" }
  },
  "cards": [
    {
      "name": "deployment_parameters",
      "schema": {
        "type": "object",
        "title": "Deployment parameters",
        "required": ["region", "ticket"],
        "properties": {
          "region": {
            "type": "string",
            "title": "Region",
            "description": "Where the new revision lands first.",
            "enum": ["us-east-1", "us-west-2", "eu-west-1"],
            "default": "us-east-1",
            "x-kai-widget": "select"
          },
          "ticket": {
            "type": "string",
            "title": "Change ticket",
            "description": "CHG-#### from the change calendar. Shaped as you type.",
            "pattern": "^CHG-[0-9]{4}$",
            "x-kai-placeholder": "CHG-4821",
            "x-kai-format": "custom",
            "x-kai-mask": "CHG-####",
            "x-kai-mask-guide": "CHG-####"
          }
        },
        "x-kai-order": ["region", "ticket"],
        "x-kai-submitLabel": "Draft the approval"
      }
    }
  ]
}
